Query,Answer,Context
growth of cybersecurity?,"Source: https://www.ey.com/en_in/giss

The growth of cybersecurity is a rapidly evolving field that has been accelerated by the COVID-19 pandemic. According to the Global Information Security Survey, the pandemic has forced organizations to transform at an accelerated speed, which has introduced new risks and potential vulnerabilities. As a result, organizations need to address these risks and ensure cybersecurity resilience for the next major disruption in this fast-moving environment.

The survey highlights the importance of cybersecurity in the decision-making process, as many organizations did not involve cybersecurity in their transformation efforts during the pandemic. This has led to a need for organizations to address the risks and potential vulnerabilities introduced during their transformation efforts, while also ensuring cybersecurity resilience for the next major disruption.

The survey also highlights the role of Chief Information Security Officers (CISOs) in driving a new focus on cybersecurity, particularly in Oceania. It also provides insights on how Irish CISOs can become enablers of innovation and growth.

In terms of solutions, the survey suggests that organizations can benefit from EY's Cybersecurity Transformation solution, which can help design, deliver, and maintain cybersecurity programs. Additionally, EY's cybersecurity, strategy, risk, compliance, and resilience teams can help organizations with their current cyber risk posture and capabilities.

Overall, the growth of cybersecurity is a critical area of focus for organizations, and the survey provides valuable insights and solutions for organizations to address the challenges and opportunities in this field.","[Document(metadata={'source_link': 'https://www.ey.com/en_in/giss', 'author_name': 'nan', 'related_topics': 'nan', 'pdf_links': 'nan', 'pk': 451726673019956103, 'relevance_score': 0.9995064}, page_content=""Global Information Security Survey\n\nOur 2021 survey delves into the impact the COVID-19 pandemic had on the cybersecurity function as it strives to position itself as an enabler of growth and a strategic partner to the business.\n\nDisruption has forced organizations to transform at an accelerated speed that would have been thought impossible just a short time ago.\n\nHowever, many organizations did not involve cybersecurity in the decision-making process, either due to oversight or urgency of the need to adapt.\n\nAs a result, these organizations need to address the risks and potential vulnerabilities that were introduced during their transformation efforts at the height of the pandemic while also ensuring cybersecurity resilience for the next major disruption in this fast-moving environment.\n\nFeatured Thinking\n\nGlobal Information Security Survey (GISS)\n\n09 Sep 9999\n\nGeographic and sector perspectives\n\nWhy CISOs in Oceania need to drive a new focus on cybersecurity\n\nHow Irish CISOs can become enablers of innovation and growth\n\nHow EY can help\n\nCybersecurity Transformation\n\nDiscover how EY's Cybersecurity Transformation solution can help your organization design, deliver, and maintain cybersecurity programs.\n\n\n\nService Leader\n\nMurali Rao\n\nEY India Cybersecurity Consulting Leader\n\nCybersecurity, strategy, risk, compliance and resilience\n\nDiscover how EY's cybersecurity, strategy, risk, compliance & resilience teams can help your organization with its current cyber risk posture and capabilities.\n\n\n\nNext generation security operations and response\n\nDiscover how EY's Next generation security operations & response team can help your organization manage leading-class security operations in a programmatic way.\n\n\n\nData protection and privacy\n\nDiscover how EY's data protection and privacy team can help your organization protect its information over the full data lifecycle.\n\n\n\nOur team\n\nOur latest thinking\n\n\n\nStay up to date with our Editor's Picks newsletter.\n\n\n\nOn the agenda (0)\n\nSkip\n\nwest east\n\n""), Document(metadata={'source_link': 'https://www.ey.com/en_in/giss', 'author_name': 'nan', 'related_topics': 'nan', 'pdf_links': 'nan', 'pk': 451726673019956109, 'relevance_score': 0.9995064}, page_content=""Global Information Security Survey\n\nOur 2021 survey delves into the impact the COVID-19 pandemic had on the cybersecurity function as it strives to position itself as an enabler of growth and a strategic partner to the business.\n\nDisruption has forced organizations to transform at an accelerated speed that would have been thought impossible just a short time ago.\n\nHowever, many organizations did not involve cybersecurity in the decision-making process, either due to oversight or urgency of the need to adapt.\n\nAs a result, these organizations need to address the risks and potential vulnerabilities that were introduced during their transformation efforts at the height of the pandemic while also ensuring cybersecurity resilience for the next major disruption in this fast-moving environment.\n\nFeatured Thinking\n\nGlobal Information Security Survey (GISS)\n\n09 Sep 9999\n\nGeographic and sector perspectives\n\nWhy CISOs in Oceania need to drive a new focus on cybersecurity\n\nHow Irish CISOs can become enablers of innovation and growth\n\nHow EY can help\n\nCybersecurity Transformation\n\nDiscover how EY's Cybersecurity Transformation solution can help your organization design, deliver, and maintain cybersecurity programs.\n\n\n\nService Leader\n\nMurali Rao\n\nEY India Cybersecurity Consulting Leader\n\nCybersecurity, strategy, risk, compliance and resilience\n\nDiscover how EY's cybersecurity, strategy, risk, compliance & resilience teams can help your organization with its current cyber risk posture and capabilities.\n\n\n\nNext generation security operations and response\n\nDiscover how EY's Next generation security operations & response team can help your organization manage leading-class security operations in a programmatic way.\n\n\n\nData protection and privacy\n\nDiscover how EY's data protection and privacy team can help your organization protect its information over the full data lifecycle.\n\n\n\nOur team\n\nOur latest thinking\n\n\n\nStay up to date with our Editor's Picks newsletter.\n\n\n\nOn the agenda (0)\n\nSkip\n\nwest east\n\n""), Document(metadata={'source_link': 'https://www.ey.com/en_in/giss', 'author_name': 'nan', 'related_topics': 'nan', 'pdf_links': 'nan', 'pk': 451726673019956115, 'relevance_score': 0.9995064}, page_content=""Global Information Security Survey\n\nOur 2021 survey delves into the impact the COVID-19 pandemic had on the cybersecurity function as it strives to position itself as an enabler of growth and a strategic partner to the business.\n\nDisruption has forced organizations to transform at an accelerated speed that would have been thought impossible just a short time ago.\n\nHowever, many organizations did not involve cybersecurity in the decision-making process, either due to oversight or urgency of the need to adapt.\n\nAs a result, these organizations need to address the risks and potential vulnerabilities that were introduced during their transformation efforts at the height of the pandemic while also ensuring cybersecurity resilience for the next major disruption in this fast-moving environment.\n\nFeatured Thinking\n\nGlobal Information Security Survey (GISS)\n\n09 Sep 9999\n\nGeographic and sector perspectives\n\nWhy CISOs in Oceania need to drive a new focus on cybersecurity\n\nHow Irish CISOs can become enablers of innovation and growth\n\nHow EY can help\n\nCybersecurity Transformation\n\nDiscover how EY's Cybersecurity Transformation solution can help your organization design, deliver, and maintain cybersecurity programs.\n\n\n\nService Leader\n\nMurali Rao\n\nEY India Cybersecurity Consulting Leader\n\nCybersecurity, strategy, risk, compliance and resilience\n\nDiscover how EY's cybersecurity, strategy, risk, compliance & resilience teams can help your organization with its current cyber risk posture and capabilities.\n\n\n\nNext generation security operations and response\n\nDiscover how EY's Next generation security operations & response team can help your organization manage leading-class security operations in a programmatic way.\n\n\n\nData protection and privacy\n\nDiscover how EY's data protection and privacy team can help your organization protect its information over the full data lifecycle.\n\n\n\nOur team\n\nOur latest thinking\n\n\n\nStay up to date with our Editor's Picks newsletter.\n\n\n\nOn the agenda (0)\n\nSkip\n\nwest east\n\n"")]"
