Query,Answer,Context
advance manufacturing growth market?,"Source: https://www.ey.com/en_in/tax/india-tax-insights/how-budget-2023-has-increased-the-attractiveness-for-ifsc-gift-ifsc

The growth of advanced materials in India is expected to be driven by various factors such as increasing demand for clean energy, growing demand for lightweight materials in the aerospace and defense industries, and the need for sustainable and cost-effective solutions in the construction sector. The Indian government has also launched several initiatives to promote the growth of advanced materials in the country, such as the National Mission on Advanced Materials and the Advanced Materials and Manufacturing Technologies (AMMT) initiative.

The advanced materials market in India is expected to grow at a CAGR of 10-12% from 2021 to 2028, driven by the demand for materials such as carbon, glass composites, silicon, lithium, and nickel. The market is expected to reach US$10 billion by 2028, with the energy sector being the largest contributor to the growth of advanced materials in India.

The growth of advanced materials in India is also expected to be driven by the increasing demand for sustainable and cost-effective solutions in the construction sector. The use of advanced materials such as glass, carbon, and wood composites, along with green steel, is expected to increase in the construction sector, driven by the need for sustainable and cost-effective solutions.

Overall, the growth of advanced materials in India is expected to be driven by a combination of factors, including increasing demand for clean energy, growing demand for lightweight materials in the aerospace and defense industries, and the need for sustainable and cost-effective solutions in the construction sector.","[Document(metadata={'source_link': 'https://www.ey.com/en_in/tax/india-tax-insights/how-budget-2023-has-increased-the-attractiveness-for-ifsc-gift-ifsc', 'author_name': 'nan', 'related_topics': 'nan', 'pdf_links': 'nan', 'pk': 451726673019956049, 'relevance_score': 0.9958333}, page_content=""Emergence of advanced materials across key manufacturing sectors in India\n\n4 minute read 09 Mar 2023\n\n\n\nTechnology\n\n\n\nAdvanced materials: the emergence of new-age materials across key manufacturing sectors in India (PDF)\n\n1 MB\n\nAdvanced materials is likely to be a US$10 billion market in India by 2028.\n\nIn brief\n\nAdvanced materials market was valued at US$5 billion in 2021 and is expected to grow at a CAGR of about 10-12%.\n\nRenewable energy, medical and aerospace/defense sectors have high penetration of advanced materials currently driven by the use of composites, ceramics and performance alloys.\n\nMaterials used in product manufacturing have a direct impact on manufacturers' revenue and margins and can assist them in creating product differentiation and driving market share.\n\nBusinesses in India are pivoting toward new-age or advanced materials, such as composites, ceramics, advanced aluminum alloys and performance alloys. This transition is driven by the demand from various end-use industries due to their better performance efficiency, lower weight and cost effectiveness.\n\nEY report, ‘Advanced materials: the emergence of new-age materials across key manufacturing sectors in India’ states that India is witnessing a surge in demand for these new-age materials and in some cases, penetration is on par with global benchmarks. Significant investment in end-use industries is driving innovation and use cases for advanced materials, which create transition-based opportunities for manufacturers as they draw up plans for sustainable growth.\n\nTrends and opportunities: from energy to construction\n\n1. Energy sector: penetration in key renewable energy applications to reach 70% by 2028\n\nThe energy sector is witnessing higher demand for clean energy, thus pushing capacity expansions in wind and solar and increasing focus on energy storage. As a result of this, the advanced material market is expected to reach US$1.96 billion in 2028 from US$0.99 billion in 2021.The growth is driven by demand for materials such as carbon, glass composites, silicon, lithium and nickel that are used in wind blades, photovoltaic cells, batteries and smart grids.\n\n2. Aerospace and defense: Penetration in key structural applications to reach 65% by 2028\n\nAerospace and defense industry is transitioning to lightweight and hypersonic aircraft with drones also becoming an integral part of the ecosystem. With a CAGR of 8% to 10%, the advanced materials market in this sector is expected to hit US$0.55 billion in 2028 from US$0.31 billion in 2021 driven by rising demand for super alloys and composites for structural applications as well as shape memory alloys and piezoelectric materials for sensors and active control components in autonomous aircraft and drones.\n\n3. Healthcare: penetration in implants and prosthetics to reach 45% by 2028\n\nHealthcare trends such as 3D printing, nanotechnology and smart prosthetics are driving the demand for advanced materials. The market is anticipated to reach US$300 million in 2028 from US$130 million with 12% to 14% CAGR. The demand will be majorly driven by increasing consumer preference for ceramic implants and other materials such as titanium and alloys, silicon, biomaterials across applications such as prosthetic limbs, spinal screws and sensors, among others.\n\n4. Automotive and transportation: penetration in key passenger vehicle applications to reach 25% by 2028\n\nAutomotive sector is witnessing a surge in demand for advanced materials driven by the need for light weighting to meet higher fuel efficiency norms and extended battery range. The market is estimated to witness a 10% to 12% CAGR from 2021 to 2028 to reach a sizable market of US$3.83 billion from US$1.83 billion. The demand is for materials such as glass and carbon composites, lithium, silicon, and nickel across applications such as battery casings, body panels, temperature and pressure sensors.\n\n5. Construction: penetration in key structural and non-structural applications to almost double by 2028\n\nSmart cities are expected to be one of the biggest pockets of demand within the building and construction sector, thus spurring the need for advanced materials. Greater adoption of modular construction as well as sharper focus on sustainability is increasing the need for green and lightweight substitute materials. The market is currently valued at US$0.6 billion to grow by a CAGR ranging from 12% to 14% to reach US$1.41 billion by 2028. Materials such as glass, carbon and wood composites along with green steel are being used, majorly finding applications in structural components, walls, rebars, facades, metro tunnels among others.\n\nMaterials as value creation levers for manufacturers\n\nLeading players across these key end use industries are proactively adopting advanced materials for product manufacturing in India, which is expected to have a direct impact on their revenue and profit margins.\n\nAligning to customer preferences, such as improved performance and lighter\n\nweight, will assist manufacturing sector in India in creating product differentiation, which will not only drive market share but also give them pricing power.\n\nThe sustainability issue that lies with traditional materials present manufacturers with an opportunity to innovate and disrupt markets. This will also help them protect margins in a post–COVID-19 world of disrupted supply chains and re-aligned government priorities.\n\nThe article is also contributed by Ishank Kataria, EY Parthenon.\n\nDownload the full pdf\n\nPDF (1 MB)\n\nSummary\n\nThere is growing demand for advanced materials across key manufacturing sectors in India, with penetration being at par with global levels in a few sectors. Increased investments in end-use industries are spurring innovation and application scenarios for advanced materials. As a result, manufacturers in India can take advantage of transition-based opportunities and plan for sustainable growth.\n\nAbout this article\n\n\n\nTechnology\n\n\n\n\n\nHow India can fill the credit gap to fuel economic growth\n\nDiscover how debt has played a crucial role in driving economic growth. Learn more about credit gaps in India.\n\nEY Global\n\n""), Document(metadata={'source_link': 'https://www.ey.com/en_in/tax/india-tax-insights/how-budget-2023-has-increased-the-attractiveness-for-ifsc-gift-ifsc', 'author_name': 'nan', 'related_topics': 'nan', 'pdf_links': 'nan', 'pk': 451726673019956054, 'relevance_score': 0.9958333}, page_content=""Emergence of advanced materials across key manufacturing sectors in India\n\n4 minute read 09 Mar 2023\n\n\n\nTechnology\n\n\n\nAdvanced materials: the emergence of new-age materials across key manufacturing sectors in India (PDF)\n\n1 MB\n\nAdvanced materials is likely to be a US$10 billion market in India by 2028.\n\nIn brief\n\nAdvanced materials market was valued at US$5 billion in 2021 and is expected to grow at a CAGR of about 10-12%.\n\nRenewable energy, medical and aerospace/defense sectors have high penetration of advanced materials currently driven by the use of composites, ceramics and performance alloys.\n\nMaterials used in product manufacturing have a direct impact on manufacturers' revenue and margins and can assist them in creating product differentiation and driving market share.\n\nBusinesses in India are pivoting toward new-age or advanced materials, such as composites, ceramics, advanced aluminum alloys and performance alloys. This transition is driven by the demand from various end-use industries due to their better performance efficiency, lower weight and cost effectiveness.\n\nEY report, ‘Advanced materials: the emergence of new-age materials across key manufacturing sectors in India’ states that India is witnessing a surge in demand for these new-age materials and in some cases, penetration is on par with global benchmarks. Significant investment in end-use industries is driving innovation and use cases for advanced materials, which create transition-based opportunities for manufacturers as they draw up plans for sustainable growth.\n\nTrends and opportunities: from energy to construction\n\n1. Energy sector: penetration in key renewable energy applications to reach 70% by 2028\n\nThe energy sector is witnessing higher demand for clean energy, thus pushing capacity expansions in wind and solar and increasing focus on energy storage. As a result of this, the advanced material market is expected to reach US$1.96 billion in 2028 from US$0.99 billion in 2021.The growth is driven by demand for materials such as carbon, glass composites, silicon, lithium and nickel that are used in wind blades, photovoltaic cells, batteries and smart grids.\n\n2. Aerospace and defense: Penetration in key structural applications to reach 65% by 2028\n\nAerospace and defense industry is transitioning to lightweight and hypersonic aircraft with drones also becoming an integral part of the ecosystem. With a CAGR of 8% to 10%, the advanced materials market in this sector is expected to hit US$0.55 billion in 2028 from US$0.31 billion in 2021 driven by rising demand for super alloys and composites for structural applications as well as shape memory alloys and piezoelectric materials for sensors and active control components in autonomous aircraft and drones.\n\n3. Healthcare: penetration in implants and prosthetics to reach 45% by 2028\n\nHealthcare trends such as 3D printing, nanotechnology and smart prosthetics are driving the demand for advanced materials. The market is anticipated to reach US$300 million in 2028 from US$130 million with 12% to 14% CAGR. The demand will be majorly driven by increasing consumer preference for ceramic implants and other materials such as titanium and alloys, silicon, biomaterials across applications such as prosthetic limbs, spinal screws and sensors, among others.\n\n4. Automotive and transportation: penetration in key passenger vehicle applications to reach 25% by 2028\n\nAutomotive sector is witnessing a surge in demand for advanced materials driven by the need for light weighting to meet higher fuel efficiency norms and extended battery range. The market is estimated to witness a 10% to 12% CAGR from 2021 to 2028 to reach a sizable market of US$3.83 billion from US$1.83 billion. The demand is for materials such as glass and carbon composites, lithium, silicon, and nickel across applications such as battery casings, body panels, temperature and pressure sensors.\n\n5. Construction: penetration in key structural and non-structural applications to almost double by 2028\n\nSmart cities are expected to be one of the biggest pockets of demand within the building and construction sector, thus spurring the need for advanced materials. Greater adoption of modular construction as well as sharper focus on sustainability is increasing the need for green and lightweight substitute materials. The market is currently valued at US$0.6 billion to grow by a CAGR ranging from 12% to 14% to reach US$1.41 billion by 2028. Materials such as glass, carbon and wood composites along with green steel are being used, majorly finding applications in structural components, walls, rebars, facades, metro tunnels among others.\n\nMaterials as value creation levers for manufacturers\n\nLeading players across these key end use industries are proactively adopting advanced materials for product manufacturing in India, which is expected to have a direct impact on their revenue and profit margins.\n\nAligning to customer preferences, such as improved performance and lighter\n\nweight, will assist manufacturing sector in India in creating product differentiation, which will not only drive market share but also give them pricing power.\n\nThe sustainability issue that lies with traditional materials present manufacturers with an opportunity to innovate and disrupt markets. This will also help them protect margins in a post–COVID-19 world of disrupted supply chains and re-aligned government priorities.\n\nThe article is also contributed by Ishank Kataria, EY Parthenon.\n\nDownload the full pdf\n\nPDF (1 MB)\n\nSummary\n\nThere is growing demand for advanced materials across key manufacturing sectors in India, with penetration being at par with global levels in a few sectors. Increased investments in end-use industries are spurring innovation and application scenarios for advanced materials. As a result, manufacturers in India can take advantage of transition-based opportunities and plan for sustainable growth.\n\nAbout this article\n\n\n\nTechnology\n\n\n\n\n\nHow India can fill the credit gap to fuel economic growth\n\nDiscover how debt has played a crucial role in driving economic growth. Learn more about credit gaps in India.\n\nEY Global\n\n""), Document(metadata={'source_link': 'https://www.ey.com/en_in/tax/india-tax-insights/how-budget-2023-has-increased-the-attractiveness-for-ifsc-gift-ifsc', 'author_name': 'nan', 'related_topics': 'nan', 'pdf_links': 'nan', 'pk': 451726673019956059, 'relevance_score': 0.9958333}, page_content=""Emergence of advanced materials across key manufacturing sectors in India\n\n4 minute read 09 Mar 2023\n\n\n\nTechnology\n\n\n\nAdvanced materials: the emergence of new-age materials across key manufacturing sectors in India (PDF)\n\n1 MB\n\nAdvanced materials is likely to be a US$10 billion market in India by 2028.\n\nIn brief\n\nAdvanced materials market was valued at US$5 billion in 2021 and is expected to grow at a CAGR of about 10-12%.\n\nRenewable energy, medical and aerospace/defense sectors have high penetration of advanced materials currently driven by the use of composites, ceramics and performance alloys.\n\nMaterials used in product manufacturing have a direct impact on manufacturers' revenue and margins and can assist them in creating product differentiation and driving market share.\n\nBusinesses in India are pivoting toward new-age or advanced materials, such as composites, ceramics, advanced aluminum alloys and performance alloys. This transition is driven by the demand from various end-use industries due to their better performance efficiency, lower weight and cost effectiveness.\n\nEY report, ‘Advanced materials: the emergence of new-age materials across key manufacturing sectors in India’ states that India is witnessing a surge in demand for these new-age materials and in some cases, penetration is on par with global benchmarks. Significant investment in end-use industries is driving innovation and use cases for advanced materials, which create transition-based opportunities for manufacturers as they draw up plans for sustainable growth.\n\nTrends and opportunities: from energy to construction\n\n1. Energy sector: penetration in key renewable energy applications to reach 70% by 2028\n\nThe energy sector is witnessing higher demand for clean energy, thus pushing capacity expansions in wind and solar and increasing focus on energy storage. As a result of this, the advanced material market is expected to reach US$1.96 billion in 2028 from US$0.99 billion in 2021.The growth is driven by demand for materials such as carbon, glass composites, silicon, lithium and nickel that are used in wind blades, photovoltaic cells, batteries and smart grids.\n\n2. Aerospace and defense: Penetration in key structural applications to reach 65% by 2028\n\nAerospace and defense industry is transitioning to lightweight and hypersonic aircraft with drones also becoming an integral part of the ecosystem. With a CAGR of 8% to 10%, the advanced materials market in this sector is expected to hit US$0.55 billion in 2028 from US$0.31 billion in 2021 driven by rising demand for super alloys and composites for structural applications as well as shape memory alloys and piezoelectric materials for sensors and active control components in autonomous aircraft and drones.\n\n3. Healthcare: penetration in implants and prosthetics to reach 45% by 2028\n\nHealthcare trends such as 3D printing, nanotechnology and smart prosthetics are driving the demand for advanced materials. The market is anticipated to reach US$300 million in 2028 from US$130 million with 12% to 14% CAGR. The demand will be majorly driven by increasing consumer preference for ceramic implants and other materials such as titanium and alloys, silicon, biomaterials across applications such as prosthetic limbs, spinal screws and sensors, among others.\n\n4. Automotive and transportation: penetration in key passenger vehicle applications to reach 25% by 2028\n\nAutomotive sector is witnessing a surge in demand for advanced materials driven by the need for light weighting to meet higher fuel efficiency norms and extended battery range. The market is estimated to witness a 10% to 12% CAGR from 2021 to 2028 to reach a sizable market of US$3.83 billion from US$1.83 billion. The demand is for materials such as glass and carbon composites, lithium, silicon, and nickel across applications such as battery casings, body panels, temperature and pressure sensors.\n\n5. Construction: penetration in key structural and non-structural applications to almost double by 2028\n\nSmart cities are expected to be one of the biggest pockets of demand within the building and construction sector, thus spurring the need for advanced materials. Greater adoption of modular construction as well as sharper focus on sustainability is increasing the need for green and lightweight substitute materials. The market is currently valued at US$0.6 billion to grow by a CAGR ranging from 12% to 14% to reach US$1.41 billion by 2028. Materials such as glass, carbon and wood composites along with green steel are being used, majorly finding applications in structural components, walls, rebars, facades, metro tunnels among others.\n\nMaterials as value creation levers for manufacturers\n\nLeading players across these key end use industries are proactively adopting advanced materials for product manufacturing in India, which is expected to have a direct impact on their revenue and profit margins.\n\nAligning to customer preferences, such as improved performance and lighter\n\nweight, will assist manufacturing sector in India in creating product differentiation, which will not only drive market share but also give them pricing power.\n\nThe sustainability issue that lies with traditional materials present manufacturers with an opportunity to innovate and disrupt markets. This will also help them protect margins in a post–COVID-19 world of disrupted supply chains and re-aligned government priorities.\n\nThe article is also contributed by Ishank Kataria, EY Parthenon.\n\nDownload the full pdf\n\nPDF (1 MB)\n\nSummary\n\nThere is growing demand for advanced materials across key manufacturing sectors in India, with penetration being at par with global levels in a few sectors. Increased investments in end-use industries are spurring innovation and application scenarios for advanced materials. As a result, manufacturers in India can take advantage of transition-based opportunities and plan for sustainable growth.\n\nAbout this article\n\n\n\nTechnology\n\n\n\n\n\nHow India can fill the credit gap to fuel economic growth\n\nDiscover how debt has played a crucial role in driving economic growth. Learn more about credit gaps in India.\n\nEY Global\n\n"")]"
