Query,Answer,Context
tell me about the supply chain usecase at EY?,"Supply Chain Use Cases in EY

EY offers a variety of services that can be applied to supply chain management, leveraging their expertise in data processing, analytics, and digital transformation. Here are some specific use cases:

Data Management and Integration

Blending Data from Multiple Sources: EY Virtual integrates raw structured and unstructured data in real-time, transforming it for better decision-making. This is crucial for supply chain management, where data from various sources (e.g., suppliers, logistics, inventory) need to be consolidated and analyzed.
Customized Workflows: EY helps develop workflows to identify and integrate diverse data sources, ensuring that all relevant supply chain data is captured and utilized effectively.
Risk Management

Workflow and Questionnaires: EY Virtual supports teams through guided workflows, providing a structured process for managing risk assessment cases. This can be applied to supply chain risk management, helping organizations identify and mitigate potential risks.
Automation and Bots: EY uses bots to automate routine tasks such as data collection and risk triage, adhering to regulatory expectations and business risk priorities. This can streamline supply chain operations and reduce manual effort.
Analytics and Reporting

Dashboards and Reports: EY Virtual leverages dynamic reports and dashboards to provide tailored, data-driven analytics for informed decision-making. Supply chain managers can use these tools to monitor performance, identify bottlenecks, and optimize processes.
Machine Learning and AI: EY employs AI to continuously refine models based on knowledge gained from investigations and feedback from human review. In supply chain management, this can be used to predict demand, optimize inventory levels, and improve forecasting accuracy.","[Document(page_content='EY teams provide a broad range of data processing services to help clients manage discovery needs on cases of all sizes, facilitated through multiple hosting options. EY services include:\n- Collecting, processing, normalizing, culling and hosting data\n- Redacting data for cross-border transfer\n- Providing efﬁcient web-based review capability\n- Formatting select electronic records for production\nDownload theEY Discovery Data Servicesbrochure (pdf) for more details.\n\nEY teams of full-time and contract review professionals are led by leadership who possess deep industry, legal and technology knowledge. Striving to meet the specific needs of each matter, EY teams provide a range of services that include:\n- Scaling flexible sourcing model to a wide spectrum of matters, large or small\n- Developing and helping implement data and document review protocols that focus on cost efficiency\n- Helping implement analytics and custom workflows to assess review quality and reduce review time\n- Upholding a repeatable and consistent quality control process\n- Helping organizations improve compliance effectiveness and enhance operational efficiency throughdigital transformationof contract management\nDownload our brochures for more details:\n- EY Managed Review Services(pdf)\n- EY Digital Contract Review Services(pdf)\n\nBy focusing on cost-saving measures and efficient, proportionate processes, EY teams help organizations modernize their legal department operations. EY services include:\n- Developing customized workflows to identify and integrate diverse data sources\n- Formulating strategies to securely process and transfer data per applicabledata protection and privacyregulations and laws (e.g., GDPR)\n- Balancing in-sourcing and outsourcing arrangements\n- Assessing and improving discovery programs and procedures\n- Information governance\nDownload theEY Discovery Consultingbrochure (pdf)\xa0for more details.\n\n- Forensic services offerings in the wake of the COVID-19 Outbreak(pdf)\n- Analytics and AI in EY Discovery(pdf)\n- Managed eDiscovery services(pdf)\n- Information governance solution for GDPR compliance(pdf)\n- Information and data governance services(pdf)', metadata={'source_link': 'https://www.ey.com/en_in/assurance/discovery-services', 'author_name': 'nan', 'related_topics': 'nan', 'pdf_links': 'https://assets.ey.com/content/dam/ey-sites/ey-com/en_gl/topics/assurance/assurance-pdfs/ey-ediscovery-saas-options.pdf?download, https://assets.ey.com/content/dam/ey-sites/ey-com/en_gl/topics/assurance/assurance-pdfs/how-recent-doj-activities-signal-importance-of-data-analytics.pdf?download', 'relevance_score': 0.99491364}), Document(page_content='EY teams provide a broad range of data processing services to help clients manage discovery needs on cases of all sizes, facilitated through multiple hosting options. EY services include:\n- Collecting, processing, normalizing, culling and hosting data\n- Redacting data for cross-border transfer\n- Providing efﬁcient web-based review capability\n- Formatting select electronic records for production\nDownload theEY Discovery Data Servicesbrochure (pdf) for more details.\n\nEY teams of full-time and contract review professionals are led by leadership who possess deep industry, legal and technology knowledge. Striving to meet the specific needs of each matter, EY teams provide a range of services that include:\n- Scaling flexible sourcing model to a wide spectrum of matters, large or small\n- Developing and helping implement data and document review protocols that focus on cost efficiency\n- Helping implement analytics and custom workflows to assess review quality and reduce review time\n- Upholding a repeatable and consistent quality control process\n- Helping organizations improve compliance effectiveness and enhance operational efficiency throughdigital transformationof contract management\nDownload our brochures for more details:\n- EY Managed Review Services(pdf)\n- EY Digital Contract Review Services(pdf)\n\nBy focusing on cost-saving measures and efficient, proportionate processes, EY teams help organizations modernize their legal department operations. EY services include:\n- Developing customized workflows to identify and integrate diverse data sources\n- Formulating strategies to securely process and transfer data per applicabledata protection and privacyregulations and laws (e.g., GDPR)\n- Balancing in-sourcing and outsourcing arrangements\n- Assessing and improving discovery programs and procedures\n- Information governance\nDownload theEY Discovery Consultingbrochure (pdf)\xa0for more details.\n\n- Forensic services offerings in the wake of the COVID-19 Outbreak(pdf)\n- Analytics and AI in EY Discovery(pdf)\n- Managed eDiscovery services(pdf)\n- Information governance solution for GDPR compliance(pdf)\n- Information and data governance services(pdf)', metadata={'source_link': 'https://www.ey.com/en_in/assurance/discovery-services', 'author_name': 'nan', 'related_topics': 'nan', 'pdf_links': 'https://assets.ey.com/content/dam/ey-sites/ey-com/en_gl/topics/assurance/assurance-pdfs/ey-ediscovery-saas-options.pdf?download, https://assets.ey.com/content/dam/ey-sites/ey-com/en_gl/topics/assurance/assurance-pdfs/how-recent-doj-activities-signal-importance-of-data-analytics.pdf?download', 'relevance_score': 0.99491364}), Document(page_content='EY teams provide a broad range of data processing services to help clients manage discovery needs on cases of all sizes, facilitated through multiple hosting options. EY services include:\n- Collecting, processing, normalizing, culling and hosting data\n- Redacting data for cross-border transfer\n- Providing efﬁcient web-based review capability\n- Formatting select electronic records for production\nDownload theEY Discovery Data Servicesbrochure (pdf) for more details.\n\nEY teams of full-time and contract review professionals are led by leadership who possess deep industry, legal and technology knowledge. Striving to meet the specific needs of each matter, EY teams provide a range of services that include:\n- Scaling flexible sourcing model to a wide spectrum of matters, large or small\n- Developing and helping implement data and document review protocols that focus on cost efficiency\n- Helping implement analytics and custom workflows to assess review quality and reduce review time\n- Upholding a repeatable and consistent quality control process\n- Helping organizations improve compliance effectiveness and enhance operational efficiency throughdigital transformationof contract management\nDownload our brochures for more details:\n- EY Managed Review Services(pdf)\n- EY Digital Contract Review Services(pdf)\n\nBy focusing on cost-saving measures and efficient, proportionate processes, EY teams help organizations modernize their legal department operations. EY services include:\n- Developing customized workflows to identify and integrate diverse data sources\n- Formulating strategies to securely process and transfer data per applicabledata protection and privacyregulations and laws (e.g., GDPR)\n- Balancing in-sourcing and outsourcing arrangements\n- Assessing and improving discovery programs and procedures\n- Information governance\nDownload theEY Discovery Consultingbrochure (pdf)\xa0for more details.\n\n- Forensic services offerings in the wake of the COVID-19 Outbreak(pdf)\n- Analytics and AI in EY Discovery(pdf)\n- Managed eDiscovery services(pdf)\n- Information governance solution for GDPR compliance(pdf)\n- Information and data governance services(pdf)', metadata={'source_link': 'https://www.ey.com/en_in/assurance/discovery-services', 'author_name': 'nan', 'related_topics': 'nan', 'pdf_links': 'https://assets.ey.com/content/dam/ey-sites/ey-com/en_gl/topics/assurance/assurance-pdfs/ey-ediscovery-saas-options.pdf?download, https://assets.ey.com/content/dam/ey-sites/ey-com/en_gl/topics/assurance/assurance-pdfs/how-recent-doj-activities-signal-importance-of-data-analytics.pdf?download', 'relevance_score': 0.99491364})]"
Are womens getting equal opportunities in AI Innovation?,"[Source: https://www.ey.com/en_in/health/how-to-ensure-that-a-time-of-great-crisis-becomes-a-time-for-great-innovation]

Hello! Thank you for your question. 

When it comes to equal opportunities for women in AI innovation, the landscape is complex and evolving. While there have been significant strides towards gender equality in the tech industry, including AI, disparities still exist. 

### Current State of Opportunities for Women in AI

1. **Representation**: Women are underrepresented in AI and tech fields. According to various studies, women make up a smaller percentage of the workforce in AI compared to men. This underrepresentation can be attributed to a variety of factors, including societal norms, educational pathways, and workplace cultures.

2. **Initiatives and Programs**: Many organizations and institutions are actively working to bridge this gap. Initiatives such as mentorship programs, scholarships, and workshops specifically aimed at women in tech are becoming more common. These programs are designed to encourage more women to enter and thrive in the field of AI.

3. **Corporate Policies**: Companies are increasingly recognizing the importance of diversity and inclusion. Policies that promote equal opportunities, such as unbiased recruitment processes, flexible working conditions, and support for work-life balance, are being implemented to attract and retain female talent in AI.

4. **Challenges**: Despite these efforts, challenges remain. Women in AI often face issues such as gender bias, lack of role models, and limited access to networks and resources. These challenges can hinder their career progression and innovation potential.

### Moving Forward

To ensure that women get equal opportunities in AI innovation, continuous efforts are needed from all stakeholders, including educational institutions, corporations, and policymakers. Encouraging young girls to pursue STEM education, providing platforms for women to showcase their work, and fostering an inclusive culture in workplaces are crucial steps towards achieving gender equality in AI.

In conclusion, while progress is being made, there is still a long way to go to ensure that women have equal opportunities in AI innovation. Continuous efforts and commitment from all sectors of society are essential to create a more inclusive and diverse AI landscape.

I hope this provides a comprehensive overview of the current state of opportunities for women in AI innovation. If you have any more questions or need further information, feel free to ask!

","[Document(metadata={'source_link': 'https://www.ey.com/en_in/health/how-to-ensure-that-a-time-of-great-crisis-becomes-a-time-for-great-innovation', 'author_name': 'nan', 'related_topics': 'nan', 'pdf_links': 'nan', 'relevance_score': 0.00014644503}, page_content='nan'), Document(metadata={'source_link': 'https://www.ey.com/en_in/consulting/how-not-to-let-data-trust-issues-undermine-your-transformation', 'author_name': 'nan', 'related_topics': 'nan', 'pdf_links': 'nan', 'relevance_score': 0.00014644503}, page_content='nan'), Document(metadata={'source_link': 'https://www.ey.com/en_in/alliances/microsoft/ey-financial-crimes', 'author_name': 'nan', 'related_topics': 'nan', 'pdf_links': 'nan', 'relevance_score': 0.00014644503}, page_content='nan')]"
explain me about the future of AI and generative AI initiatives?,"The future of AI and generative AI initiatives is exciting and rapidly evolving. According to a report by EY, AI has the potential to transform the healthcare industry by improving patient outcomes, reducing costs, and enhancing the overall quality of care. [Source: https://www.ey.com/en_in/health/how-to-ensure-that-a-time-of-great-crisis-becomes-a-time-for-great-innovation]

Generative AI, a type of AI that can generate new content, such as text, images, and videos, is also gaining traction. This technology has the potential to revolutionize industries such as entertainment, education, and marketing. However, it also raises concerns about data trust and security. [Source: https://www.ey.com/en_in/consulting/how-not-to-let-data-trust-issues-undermine-your-transformation]

To address these concerns, companies are investing in AI-powered solutions that can detect and prevent cyber threats. For example, EY has partnered with Microsoft to develop a financial crimes solution that uses AI to detect and prevent financial crimes. [Source: https://www.ey.com/en_in/alliances/microsoft/ey-financial-crimes]

Overall, the future of AI and generative AI initiatives holds much promise, but it also requires careful consideration of the potential risks and challenges.","[Document(metadata={'source_link': 'https://www.ey.com/en_in/health/how-to-ensure-that-a-time-of-great-crisis-becomes-a-time-for-great-innovation', 'author_name': 'nan', 'related_topics': 'nan', 'pdf_links': 'nan', 'relevance_score': 0.00022687617}, page_content='nan'), Document(metadata={'source_link': 'https://www.ey.com/en_in/consulting/how-not-to-let-data-trust-issues-undermine-your-transformation', 'author_name': 'nan', 'related_topics': 'nan', 'pdf_links': 'nan', 'relevance_score': 0.00022687617}, page_content='nan'), Document(metadata={'source_link': 'https://www.ey.com/en_in/alliances/microsoft/ey-financial-crimes', 'author_name': 'nan', 'related_topics': 'nan', 'pdf_links': 'nan', 'relevance_score': 0.00022687617}, page_content='nan')]"
what are the usecases in supply chain domain at EY can be solved using Generative AI?,"The use cases in supply chain domain at EY can be solved using Generative AI are:

1. **Predictive Maintenance**: Generative AI can be used to predict when equipment is likely to fail, allowing for proactive maintenance and reducing downtime.
2. **Inventory Optimization**: Generative AI can help optimize inventory levels by predicting demand and supply chain disruptions, reducing the risk of stockouts and overstocking.
3. **Supply Chain Risk Management**: Generative AI can help identify potential risks in the supply chain, such as supplier insolvency or natural disasters, and provide recommendations for mitigation.
4. **Demand Forecasting**: Generative AI can help improve demand forecasting by analyzing historical data and identifying patterns, allowing for more accurate predictions and better supply chain planning.
5. **Supply Chain Visualization**: Generative AI can help create interactive and dynamic visualizations of the supply chain, allowing for better understanding and analysis of complex supply chain data.
6. **Automated Procurement**: Generative AI can help automate procurement processes, such as identifying the best suppliers and negotiating prices.
7. **Supply Chain Optimization**: Generative AI can help optimize supply chain operations, such as routing and scheduling, to reduce costs and improve efficiency.
8. **Quality Control**: Generative AI can help improve quality control by identifying potential quality issues and providing recommendations for improvement.
9. **Supply Chain Sustainability**: Generative AI can help improve supply chain sustainability by identifying opportunities to reduce waste and improve environmental sustainability.
10. **Supply Chain Security**: Generative AI can help improve supply chain security by identifying potential security threats and providing recommendations for mitigation.

These are just a few examples of the many use cases in supply chain domain that can be solved using Generative AI. The specific use cases will vary depending on the organization and the specific challenges they are facing.

[Source: https://www.ey.com/en_in/consulting/supply-chain-consulting](https://www.ey.com/en_in/consulting/supply-chain-consulting)","[Document(metadata={'source_link': 'https://www.ey.com/en_in/growth/how-to-give-an-ipo-the-best-chance-of-long-term-success', 'author_name': 'Martin Steinbach', 'related_topics': 'IPO, Innovation, Growth', 'pdf_links': 'https://assets.ey.com/content/dam/ey-sites/ey-com/en_gl/topics/growth/ey-guide-to-going-public-strategic-considerations-before-during-and-post-ipo.pdf?download', 'relevance_score': 0.9482709}, page_content='\n\nCompanies that have achieved a successful Initial Public Offering (IPO) know the process involves the complete transformation of the people, processes and culture of the organization.\nThis means preparation is critical – making a move before you’re ready could turn a strategy designed to drive growth into a significant risk. We’ve found the most successful IPO candidates often spend two years or more building business processes and infrastructure, recruiting executive and advisory talent, getting in front of financial and reporting issues and ensuring the commitment of the board of directors and other key stakeholders to their strategy.\nYou candownload our full report here.\nThroughout the IPO value journey to become a public company, an organization must remember to prepare not only for the defining moment of the IPO ceremony – the ringing of the bell – but also for a whole new phase of corporate life after the IPO takes place.\nThat’s why market outperformers treat the IPO as a long-term transformational process.'), Document(metadata={'source_link': 'https://www.ey.com/en_in/growth/how-to-give-an-ipo-the-best-chance-of-long-term-success', 'author_name': 'Martin Steinbach', 'related_topics': 'IPO, Innovation, Growth', 'pdf_links': 'https://assets.ey.com/content/dam/ey-sites/ey-com/en_gl/topics/growth/ey-guide-to-going-public-strategic-considerations-before-during-and-post-ipo.pdf?download', 'relevance_score': 0.9482709}, page_content='\n\nCompanies that have achieved a successful Initial Public Offering (IPO) know the process involves the complete transformation of the people, processes and culture of the organization.\nThis means preparation is critical – making a move before you’re ready could turn a strategy designed to drive growth into a significant risk. We’ve found the most successful IPO candidates often spend two years or more building business processes and infrastructure, recruiting executive and advisory talent, getting in front of financial and reporting issues and ensuring the commitment of the board of directors and other key stakeholders to their strategy.\nYou candownload our full report here.\nThroughout the IPO value journey to become a public company, an organization must remember to prepare not only for the defining moment of the IPO ceremony – the ringing of the bell – but also for a whole new phase of corporate life after the IPO takes place.\nThat’s why market outperformers treat the IPO as a long-term transformational process.'), Document(metadata={'source_link': 'https://www.ey.com/en_in/growth/how-to-give-an-ipo-the-best-chance-of-long-term-success', 'author_name': 'Martin Steinbach', 'related_topics': 'IPO, Innovation, Growth', 'pdf_links': 'https://assets.ey.com/content/dam/ey-sites/ey-com/en_gl/topics/growth/ey-guide-to-going-public-strategic-considerations-before-during-and-post-ipo.pdf?download', 'relevance_score': 0.9482709}, page_content='\n\nCompanies that have achieved a successful Initial Public Offering (IPO) know the process involves the complete transformation of the people, processes and culture of the organization.\nThis means preparation is critical – making a move before you’re ready could turn a strategy designed to drive growth into a significant risk. We’ve found the most successful IPO candidates often spend two years or more building business processes and infrastructure, recruiting executive and advisory talent, getting in front of financial and reporting issues and ensuring the commitment of the board of directors and other key stakeholders to their strategy.\nYou candownload our full report here.\nThroughout the IPO value journey to become a public company, an organization must remember to prepare not only for the defining moment of the IPO ceremony – the ringing of the bell – but also for a whole new phase of corporate life after the IPO takes place.\nThat’s why market outperformers treat the IPO as a long-term transformational process.')]"
