Website,Date,author_name,related_topics,pdf_links,page_content
https://www.ey.com/en_in/consumer-products-retail/how-covid-19-could-change-consumer-behavior,2021-05-01,Kristina Rogers,"Future consumer index, Consumer products and retail, FutureConsumer.Now",https://assets.ey.com/content/dam/ey-sites/ey-com/en_gl/topics/consumer-products/consumer-products-pdfs/ey-future-consumer-index-issue-1.pdf?download,"Daily life for people around the world has changed in ways that would have been unthinkable a few weeks ago. But as consumer-facing organizations try to find their way through the COVID-19 pandemic, it’s important to keep in mind that the global consumer was already evolving at great speed. That process is now playing out faster than anyone imagined.
Consumer-facing companies urgently need to anticipate what kind of consumer is emerging, so they can make it through the current crisis and build the capabilities that future relevance will require. We created ourFutureConsumer.Nowprogram two years ago to guide those efforts.
Now we’ve created the EY Future Consumer Index to help leaders understand and track emerging consumer behaviors and sentiment around the world. Over the coming months, we’ll identify the new segments we see emerging – asking which are temporary reactions to changing circumstances, and which point to more fundamental shifts.
In these early stages of the pandemic, consumers are worried about the health of their families, whether they can buy for their basic needs, and the loss of freedoms we all took for granted. Those common concerns are manifesting themselves in different ways, as consumers adopt new behaviors.Across the markets we’ve surveyed, some consumers are making deep cuts. Others are continuing to spend as normal but are changing how they live in other ways. For now, many are remarkably optimistic. Looking across all the Index data, we’ve identified four segments of behavior.

Consumers in the “Hibernate and spend” segment – who are mostly aged 18-44 – are those most concerned about the impact of the pandemic. But only 40% of them say they are shopping less frequently. And while 42% say the products they buy have changed significantly, 46% of them say brands are now more important to them.
The Index shows much bigger changes in the “Cut deep” segment. These consumers – who are mainly over 45 – have seen the most impact on their employment. Almost a quarter have had their jobs suspended, either temporarily or permanently. Seventy-eight percent of them are shopping less frequently, and 64% are only buying the essentials. In contrast to the Hibernate and spend segment, 33% of consumers here feel brands are now far less important to them.
Our Index will track the way these segments evolve and highlight any new ones that emerge, as this immediate phase of the crisis unfolds.
Looking beyond the immediate effects of the pandemic, few consumers expect to go back to their old behaviors any time soon. As with many of the shocks we encounter in life, people are in a mood to pause and reflect. The Index gives substance to that anecdotal observation.
We’ve asked consumers what they believe they will do once they feel the crisis is over. This doesn’t tell us what theywillactually do, but it does enable us to track their changing expectations about the future.
The chart below maps how the four segments we have identified now could morph into five very different ones as the crisis abates. For example, the Index currently suggests that over time most consumers in the “Save and stockpile” segment will migrate to two new segments that we call “Remain frugal” and “Cautiously extravagant.”

In these uncertain times, how long this transition will take – or whether different transitions will emerge – remains to be seen. But tracking change as it occurs will help companies stay relevant and plan for the future.

We surveyed 4,859 consumers across the US, Canada, UK, France and Germany during the week of 6 April 2020. The survey questionnaire covered current behaviors, sentiment and intent."
https://www.ey.com/en_in/consumer-products-retail/how-to-serve-the-anxious-consumer-after-covid-19,2020-06-26,Kristina Rogers,"Consumer products and retail, FutureConsumer.Now, Customer, Technology, COVID-19",,"

In thefirst edition of our Indexwe showed how the crisis is creating new consumers segments. Four segments describe how consumers are changing in the early phase of the pandemic. Another five are defined by the behaviors and attitudes consumers say they will adopt once they feel the crisis is over. For this latest edition of the Index we’ve updated the percentage of consumers in each segment and included China for the first time.

As you can see from the chart, consumers in China are far more likely to be in the segment we call “Hibernate and spend” and far less likely to be in “Cut deep.” This could be an encouraging sign for organizations that are looking to China as a lead indicator of how fast consumer sentiment will rebound. While the consumers who have lived in a coronavirus world the longest remain cautious, they are at least spending more again. What does this mean for the Chinese consumer’s spending habits? Overall, Chinese consumers are now spending more in a wider range of categories. But some categories are rebounding much faster than others.
We asked people how much they expect their household spending to change across a range of categories over the next month, assuming their current social distancing situation continues. This identified big shifts to fresh food (62% expecting to spend more or significantly more), personal care (47%), beauty and cosmetics (29%), and clothing and footwear (33%). As people go back out into the world, they want to eat a healthy diet and look after their appearance. This should give cheer to producers who want to sell products that address these needs in other markets.

Good health, currently one of the best defenses against COVID-19, is a high priority for the Anxious Consumer globally. Fifty-four percent of consumers say whether a food product is “healthy and good for me” has become a more important attribute over the past month. It’s second only to availability, which was cited by 59%. In China, it’s the number one attribute (cited by 74%). When we ask consumers what they think they will value most when shopping five years from now, it’s second only to quality and in China it’s number one.
We see the same encouraging signs when we look further into the future. China’s consumers are far more likely to be in the segments we call “Back with a bang” and “Cautiously extravagant.” And it’s interesting to note how few are in the “Return to normal” segment.

This is further evidence that Chinese consumers feel positive and are looking to a bright future. But the Index suggests they are changing their preferences and behaviors fast, and very few plan to go back to life as they used to live it.
One critical question is whether the new behaviors and sentiments described by our segments will stick. Consumers can make bold statements about how they will behave when this is over, but when will that be? Will we discover an effective vaccine? How quickly could it be manufactured at scale and given to people who need it? How long will inoculation last? What will happen to economies and people’s livelihoods in the meantime? Nobody yet knows.
We think that more consumers, faced with no clear answers, will adopt an “always-on-emergency mindset.” This is a worldview characterized by a heightened sensitivity to risk, both real and perceived. It’s one of the 150 drivers of change we’ve modeled in ourFutureConsumer.Nowprogram. We use it to describe the way that a rise in global shocks that feel beyond the control of any individual —  like terrorist attacks, natural disasters and financial crises — changes the way that consumers behave and react to them.
A new normal emerges as people become accustomed to crisis. Events that would have had a significant impact feel part of business as usual. That doesn’t mean that people become blasé about them; on the contrary, it creates a consumer who is defined by a greater sense of general alertness. People are more cautious and pragmatic, both in their day-to-day lives and in their decisions around travel or event attendance, for example.
Looking at the global data, our Index highlights some of the significant ways that consumers around the world expect to live more risk-aware lives. Overall, 52% said they will change the way they shop. Of those, 70% said they will be more aware of hygiene and sanitation when they go shopping; 60% will consolidate their shopping trips into less frequent, but larger purchases; and 44% will do more of their grocery shopping online.

When we asked people what else would change for them, 36% said they will eat differently. Of those, 68% plan to cook for themselves or their families more often. And 46% say that if they eat in a restaurant, they will be more likely to choose one that has more space between customers. The post-lockdown risk attitudes of consumers in China are an insight into how consumer attitudes elsewhere might change, and what it would take for companies to remain relevant. There are two standout imperatives we want to share in this bulletin.
If you want to serve the Anxious Consumer, you must go the extra mile to help them feel safe. Perhaps it’s no surprise that, as the chart below shows, consumers in China are today less worried about returning to certain activities than consumers elsewhere. They have the longest experience of living with coronavirus and they came out of lockdown first.
Yet in absolute terms they do still remain extremely cautious about returning to many of the activities that were once part of their normal, every-day lives. For example, 64% are uncomfortable or extremely uncomfortable with the idea of going to the movies and 61% feel the same about going to a bar. This suggests the pandemic has affected consumer attitudes at a deep level.

Companies must adapt to a new kind of consumer — one with priorities, attitudes and behaviors shaped by the experience of living though a global humanitarian crisis. This will require digital change at an extraordinary pace. Can leaders implement five years of digital progress in six months?
The bottom line is that consumer-facing companies have shaped their business strategies, product portfolios, and marketing or engagement around a consumer that values purpose and innovation. But that is not what the Anxious Consumer values. Their buying decision isn’t a trade-off between value and cost, or value and some felt expression of their identity — it’s more about “Is what I’m buying or experiencing worth the risks I’m taking?” This is a new challenge. But it’s one that companies that act now can turn into an opportunity.

We surveyed 12,843 consumers across the US, Canada, Brazil, UK, France, Germany, India, UAE, Saudi Arabia, China, Japan, Australia and New Zealand during the week of 4 May 2020. The survey questionnaire covered current behaviors, sentiment and intent."
